{
  "schema_version": "rendered-sink-lineage-capability-contract/1.0.0",
  "id": "atlas.rendered-sink-lineage.capability-catalog.v1",
  "state": "declared_incomplete",
  "closes_global_gate": false,
  "global_denominator": {
    "kind": "bounded_curated_content_claim_denominator",
    "expected_candidates": 2140,
    "in_scope_candidates": 426,
    "out_of_scope_candidates": 1714,
    "independently_reviewed": 0,
    "unresolved": 2140,
    "claim_contract_digest": "cf123369749c14ef140a9eb906b63f7183e93fd45a943a25087f5411a17399b6",
    "classification_digest": "594013cefc9f293cb6b224e6f869014e6015dd6f23a4ff708899afbb44c1f19c",
    "source_receipts_digest": "aad6fbb1305ccaddea2b5257cbfa5704ba1548a1855c97bcbaa144ed6d8ecb30",
    "candidate_set_digest": "ed4bb19838118841b5f5cc3a3d7348ee9763d11e8f4ad4f610c5e3853a1f0d31"
  },
  "source_scope": {
    "path": "master-reference/content/capability-catalog.json",
    "git_blob_oid": "bbd5fc3f6ff524299a580bce0925e27b85597f0f",
    "sha256": "b62290c58b7427dd96a38206715bef4cd65a4847c7442112ddd678c573c8774e",
    "expected_records": 227,
    "expected_candidates": 426,
    "expected_safety_inputs": 7,
    "candidate_digest": "69c1b86c5ca41aca8b6f332e604448e024f3339a4f486b36a1ed4679025cd9ed",
    "facet_id_set_digest": "33488e2d456d874f0d80059e94fc196a0bb927e11deef58a7e274485f91d1f89",
    "candidate_rules": [
      {"rule_id": "capability.root", "record_kind": "capability_catalog", "selector": "root", "identity": "root", "expected_records": 1, "candidate_fields": []},
      {"rule_id": "capability.entry_contract", "record_kind": "capability_entry_contract", "selector": "entry_contract", "identity": "root", "expected_records": 1, "candidate_fields": []},
      {"rule_id": "capability.domain", "record_kind": "capability_domain", "selector": "domains", "identity": "id", "expected_records": 12, "candidate_fields": []},
      {"rule_id": "capability.entry", "record_kind": "capability_entry", "selector": "entries", "identity": "id", "expected_records": 213, "candidate_fields": ["state", "current_scope"]}
    ],
    "safety_rules": [
      {"rule_id": "capability.root", "selector": "root", "identity": "root", "expected_records": 1, "fields": [{"field": "denominator_rule", "expected_value": "Every entry in this finite version is classified. Adding or removing an entry changes the denominator and must be disclosed as scope evolution, never disguised as progress or regression."}]},
      {"rule_id": "capability.entry_contract", "selector": "entry_contract", "identity": "root", "expected_records": 1, "fields": [{"field": "current", "expected_value": "Requires at least one live owner reference and a bounded support statement."}, {"field": "partial", "expected_value": "Requires owner references for the implemented slice plus at least one actionable gap reference."}, {"field": "incomplete", "expected_value": "Missing, gated, excluded, and unknown entries require at least one dispositioned gap reference."}, {"field": "catalog_presence", "expected_value": "An entry documents the landscape; it is not a support promise unless state=current."}]},
      {"rule_id": "capability.entry", "selector": "training_entry", "identity": "id", "expected_records": 1, "fields": [{"field": "content_role", "expected_value": "advisory"}, {"field": "mutates_assessment_truth", "expected_value": false}]}
    ]
  },
  "sink_universe": {
    "complete": false,
    "declared_count": 2,
    "known_omitted_classes": [
      "nondefault_web_filter_query_and_runtime_states",
      "other_curated_content_sources",
      "other_web_routes_and_states",
      "other_pdf_sections",
      "fixed_template_claims",
      "computed_and_joined_claims",
      "responsive_print_locale_and_runtime_variants"
    ]
  },
  "sinks": [
    {
      "sink_id": "pdf.capability-catalog",
      "kind": "output.pdf",
      "locator": "master-reference.pdf#closed-capability-catalog",
      "renderer_path": "master-reference/release/pdf_report.py",
      "renderer_symbol": "_capabilities",
      "expected_rendered": 426,
      "expected_omitted": 0,
      "rendered_rules": [
        {"rule_id": "capability.entry", "fields": [{"facet_path": "state", "disposition": "rendered_labeled", "slot_template": "pdf.capabilities.capability.entry.{record_identity}.state", "transform_id": "pdf.capability_heading_state/1"}, {"facet_path": "current_scope", "disposition": "rendered_labeled", "slot_template": "pdf.capabilities.capability.entry.{record_identity}.current_scope", "transform_id": "pdf.capability_scope_plain_text/1"}], "expected_subjects": 426}
      ],
      "omission_rules": [],
      "safety_mappings": [
        {"rule_id": "capability.root", "fields": [{"field": "denominator_rule", "slot_template": "pdf.capabilities.capability.root.@root.denominator_rule", "transform_id": "pdf.capability_support_contract/1"}], "expected_inputs": 1},
        {"rule_id": "capability.entry_contract", "fields": [{"field": "current", "slot_template": "pdf.capabilities.capability.entry_contract.@root.current", "transform_id": "pdf.capability_support_contract/1"}, {"field": "partial", "slot_template": "pdf.capabilities.capability.entry_contract.@root.partial", "transform_id": "pdf.capability_support_contract/1"}, {"field": "incomplete", "slot_template": "pdf.capabilities.capability.entry_contract.@root.incomplete", "transform_id": "pdf.capability_support_contract/1"}, {"field": "catalog_presence", "slot_template": "pdf.capabilities.capability.entry_contract.@root.catalog_presence", "transform_id": "pdf.capability_support_contract/1"}], "expected_inputs": 4},
        {"rule_id": "capability.entry", "fields": [{"field": "content_role", "slot_template": "pdf.capabilities.capability.entry.cap.engine.training-curriculum.content_role", "transform_id": "pdf.capability_entry_boundary/1"}, {"field": "mutates_assessment_truth", "slot_template": "pdf.capabilities.capability.entry.cap.engine.training-curriculum.mutates_assessment_truth", "transform_id": "pdf.capability_entry_boundary/1"}], "expected_inputs": 2}
      ]
    },
    {
      "sink_id": "web.capabilities.default",
      "kind": "private_web_route",
      "locator": "/capabilities",
      "renderer_path": "master-reference/app/atlas/CapabilityExplorer.tsx",
      "renderer_symbol": "CapabilityExplorer",
      "expected_rendered": 426,
      "expected_omitted": 0,
      "rendered_rules": [
        {"rule_id": "capability.entry", "fields": [{"facet_path": "state", "disposition": "rendered_derived", "slot_template": "web.capabilities.capability.entry.{record_identity}.state", "transform_id": "state-mark-label"}, {"facet_path": "current_scope", "disposition": "rendered_identity", "slot_template": "web.capabilities.capability.entry.{record_identity}.current_scope", "transform_id": "identity-text"}], "expected_subjects": 426}
      ],
      "omission_rules": [],
      "safety_mappings": [
        {"rule_id": "capability.root", "fields": [{"field": "denominator_rule", "slot_template": "web.capabilities.capability.root.@root.denominator_rule", "transform_id": "visible-source-contract-text"}], "expected_inputs": 1},
        {"rule_id": "capability.entry_contract", "fields": [{"field": "current", "slot_template": "web.capabilities.capability.entry_contract.@root.current", "transform_id": "visible-source-contract-text"}, {"field": "partial", "slot_template": "web.capabilities.capability.entry_contract.@root.partial", "transform_id": "visible-source-contract-text"}, {"field": "incomplete", "slot_template": "web.capabilities.capability.entry_contract.@root.incomplete", "transform_id": "visible-source-contract-text"}, {"field": "catalog_presence", "slot_template": "web.capabilities.capability.entry_contract.@root.catalog_presence", "transform_id": "visible-source-contract-text"}], "expected_inputs": 4},
        {"rule_id": "capability.entry", "fields": [{"field": "content_role", "slot_template": "web.capabilities.capability.entry.cap.engine.training-curriculum.content_role", "transform_id": "visible-source-contract-text"}, {"field": "mutates_assessment_truth", "slot_template": "web.capabilities.capability.entry.cap.engine.training-curriculum.mutates_assessment_truth", "transform_id": "visible-source-contract-text"}], "expected_inputs": 2}
      ]
    }
  ],
  "limitations": [
    "This is a source-to-sink lineage slice for the capability catalog and two declared default sinks, not a global rendered-claim denominator.",
    "The web scope is the unfiltered default locator only; query, filter, hydration, responsive, locale, and runtime variants remain outside this slice.",
    "Payloads are omitted but unsalted value fingerprints can be dictionary-recovered for low-entropy values and are not confidentiality.",
    "A mapping PASS supplies no semantic acceptance, reviewer authentication, evidence efficacy, publication authority, or claim-evidence promotion.",
    "The 1714 out-of-scope curated facets and all undeclared template, computed, joined, conditional, locale, responsive, print, and runtime sink variants remain unresolved."
  ]
}
